,reviews
0,Super phone go for itREAD MORE
1,Good 👍READ MORE
2,Good product 👍👍👍READ MORE
3,so nice in all functions and more in design and colour..READ MORE
4,GoodREAD MORE
5,"Best Phone 📱 It,s Very Smooth Design Battery 🔋 is Biggest  Phone Design PerfectREAD MORE"
6,Good phone I like u 😊READ MORE
7,Worth for moneyGreat DisplaySmooth performanceREAD MORE
8,Nice phoneREAD MORE
9,AmazingREAD MORE
10,This smartphone is awesome.Camera quality is perfect battery is also awesome. Design is premium feel.READ MORE
11,That's really outstanding cameraREAD MORE
12,Pros1) Looks premium2) curved display give premium feel3) fast charging4) decent processor 5) camera perform excellent in light 2x zoom works very well ConsCamera1)  portrait mode need improvement my redmi note 9 pro max is almost 3 year old but it's portrait are still better than most of the new phone I have seen2) need little improvement in low light capabilityDisplay1) display brightness is ok but need a little improvementREAD MORE
13,Please fix battery performanceREAD MORE
14,"Charging speed, display and battery is the highlight of the phone. Will test and write more about it soon.READ MORE"
15,Worth for moneyGreat DisplaySmooth performanceREAD MORE
16,Great product by realmeREAD MORE
17,Satisfying product at this price range...READ MORE
18,Awesome 😎Quality of images are mind-blowing 😍READ MORE
19,Good product.nice looking thankyou Flipkart.🤟READ MORE
20,Mobile performance is so better.Super curve display.READ MORE
21,"Phone is too good in performence ,display ,camera 👌READ MORE"
22,"The design is ultimately awesome fantastic or any other word whatever we can praise it. I am flat on the design of the phone. It is distinct from the market. However, keep a note in mind that the stitching at the back and the centre strip is only embossing and not real stitching or the fabric centre strip. The centre strip is covered by transparent plastic. The display is flawless and the curved design gives a premium feel. It is not a heavy duty phone but battery 🔋 lost for a full day comfo...READ MORE"
23,"Wonder full phone. Camera is amazing. display is so nice. Best 5G phone. Thank Realme, Thanks flipkart.READ MORE"
24,Nice mobileREAD MORE
25,Good 👍READ MORE
26,Camera is good But at dark light som noise will u notice Performance is good while playing bgmiREAD MORE
27,Camera is of 100mp but quality of pictures is not very good.it is pretty good for gaming too.design is outstanding.display is just fantasticREAD MORE
28,Design 5/5Display 5/5Charger 5/5Performance 4/5Camera 5/5  Back camera captures sharp and detailed images.READ MORE
29,Very nice performanceREAD MORE
30,Awesome phone smooth nice display sound very nice performance ok for day to day use no lag at all if u looking for budget all rounder phone go for itREAD MORE
31,Awesome product 🥰🥰🥰🥰🥰READ MORE
32,Excellent product. Need improvement in camera. Update needed.READ MORE
33,Auto restart problem twice a day !! What to do ?? Plz help!! Horrible 😢READ MORE
34,In this price this mobile is very good bt the battery life is not as per standard.READ MORE
35,A very best product at this price segment I loved this smart phone well combination of software and hardware worth buying thanks to Flipkart for on time dilvery . Far more best than OnePlus Nord ce3liteREAD MORE
36,Marvellous designMain Camera : 10/10 Night Mode : 10/10Portrait : 10/10Zoom : 9/10Front Camera : 10/10Video : 9/10Battery : 10/10Performance : 10/10If you are looking for an all-rounder device under 25K budget then this can be your perfect choice.READ MORE
37,"For gaming don't buy it very choppy and freezing gaming experience I don't think so it's dimensity 7050, I'm regretting after buying it.😡READ MORE"
38,NYC displayREAD MORE
39,"Value for money, looking premium in this budgetREAD MORE"
40,Display quality so awesome and leather disign is so attract.Nice phoneREAD MORE
41,Amazing PhoneREAD MORE
42,Good nice product I love itREAD MORE
43,This is so good phoneREAD MORE
44,Camera is good as per price point performance is decent with minor lag battey is good about 10 hrs sot on wifi with 2% left display is great like flagshipREAD MORE
45,Review after 10 daysLook and feel goodPerformance also ok little bit hiting issue Speaker medium qualityBattery backup only one day Camera is not ok need improvement by software appdate only gimmick 100 mp camera I have lg g6 13 mp camera is good campare to 11 proREAD MORE
46,Everything is perfect except battery performance there is the main thing that will be disappointed usNd Camera quality is amazingREAD MORE
47,"Just opened new phone, but it's battery draining in few hours, within 4-5 hours it's become 100 % to 10%READ MORE"
48,Value for money 🤑💰READ MORE
49,Overall a good product.READ MORE
50,SuperbREAD MORE
51,The camera shefty is not there. Heating problemIt's tooooooo length.Some ui options are not available.READ MORE
52,"Apart From Design  its a Very Average Smartphone.Design 5/5 (Feels Premium)Display 4.5/5Camera 1.5/5 ( Even my K20 pro has Better Camera Quality)Performance 3/5 ( Heats alot, Lack of optimization)UI ( Loaded with Ads)Verdict: Don't buy this smartphone due to it's look go for other options which offers better camera quality and well optimized Experience.READ MORE"
53,Very nice phone....gd camera and working smooth...all over wowwww thanks realme🙏💯👍READ MORE
54,Perfect phoneREAD MORE
55,Overall good nd display are very very goodREAD MORE
56,Quality is good camera quality goodLooking goodBest part in this phone is phone design and back side leather. Many features add and it's work on latest Google updateREAD MORE
57,Overall good product value for money camera is averageREAD MORE
58,Camera quality not good ..battery drain problemREAD MORE
59,"**Don't buy** Recently purchased this product and I am really disappointed. First of all the product processor is very very underated as compared to its price, camera quality is not good ,only selfie camera is like ok ok. 3rd most important thing is that the phone consist of very very much bugs. So I have contact to the company but they are telling me to do factory reset and backup your data and for this purpose visit to your nearest realme store , some applications some additional features ...READ MORE"
60,Nice mobile phoneREAD MORE
61,READ MORE
62,Design 5/5 (feels premium) Display 5/5 (Very smooth) Camera 5/5 (Amazing results) Performance 4/5 (Needs a bit more optimization)Charging 5/5 (Very fast) Battery 5/5 (Good performance) Sound 5/5 (Stereo speakers are quite loud)READ MORE
63,Design and display is best in this price range 🔥READ MORE
64,AwesomeREAD MORE
65,"Camera4/5,Good phone,Nice design it feels like premium phones,Display is amazing.You should must buy it.READ MORE"
66,A well balanced phone but it is heating maybe it's summer time that's why it is heating. But the phone heats and that what I am not liking otherwise phone is ok and give nice feel in handsREAD MORE
67,Very nice product 😍😍😍READ MORE
68,Bad quality of camera picture.READ MORE
69,It's good fabulousREAD MORE
70,I like very muchREAD MORE
71,Really good!!! The phone is looking stylish and awesome.READ MORE
72,Nice display 🤩Battery pickup is very goodSound quality excellent 👍Camera quality is amazing 🤩READ MORE
73,Good QualityREAD MORE
74,"Superb quality best phone 📱 ,💫❤️❤️❤️❣️❣️❣️❣️🎉💯READ MORE"
75,Good Product...At This Price Range..Display Is GoodCamera Is Also Good 😊READ MORE
76,Camera quality is very bad 😔READ MORE
77,Excellent Value for money 💰🥰🥰READ MORE
78,Superb quality camera.i love itREAD MORE
79,It is totally worthless mobile I have used. Requested two times for return but there was no support from Flipkart. Very disappointed.READ MORE
80,This is not good phone at this price point. lotes ades and also take time in lounching application.READ MORE
81,Cam good Display good Performance is perfectCons.Battery capacity is low In heavy task it work only 2.5 hrs Other wise pH is perfectREAD MORE
82,Very nice 👍 smart mobileREAD MORE
83,Camera 3.5/5Display 4/5Battery 4/5Performance 4/510 minutes used over Heating.READ MORE
84,Good product need updates on camera good displayREAD MORE
85,GoodREAD MORE
86,The Best all rounder🔥READ MORE
87,Very good phoneREAD MORE
88,Good looking phn but only one slot of sim card is 5gREAD MORE
89,"Explore the world with 120Hz Curved Display and 100MP OIS ProLight Camera. 67W SuperVOOC Fast Charge, 5000mAh Battery and premium leather design.READ MORE"
90,This is the flagship phone design display is amazing and looking is good and performance also good 👍.READ MORE
91,This product is good 💯Iam happy with this productDisplay is superb ... design outstanding...About price this product is overallREAD MORE
92,Amazing mobile phone in this price range one can go for itREAD MORE
93,"Very nice product. Thank you Flipkart. Many people review many things but in this price segment, you can go for it. An all-rounder in this price with a curved display.READ MORE"
94,Price is very good 👍👍👍READ MORE
95,Best designREAD MORE
96,This mobile is very slow. And camera is fake. West of money😡😡 realme cheating with us. Dond buy this guys 🙏🙏🙏READ MORE
97,Super nice...Worth it...! Love this product..❤️❤️READ MORE
98,This smartphone is best and design is very good. Thank you 🙏 Flipkart.READ MORE
99,It's very splendidREAD MORE
100,Nice display and designREAD MORE
101,Very very good product in this price i am so happy with this phoneREAD MORE
102,"I have purchased this mobile. This mobile have descent performance but mobile design is very good and battery is also descent it will give you 1 day and approx 7.30 hours screen on time. Camera  is also descent, it not like 100 megapixel it works like 64 megapixel camera. So you can purchase this device surely.READ MORE"
103,Overall good 👍READ MORE
104,"Battery capacity is avarageAnd display, disign is very very excellent 👌👍READ MORE"
105,Good quality and (extra Apps can be disabled) (but camer don't have wide angle option) battery is good (mobile looks are osm)READ MORE
106,Nice pic video call cemeraREAD MORE
107,"Mobile is good, camera quality is also good, this is the cheapest price that you have got an edge mobile.READ MORE"
108,Mobile has heating problem 😰😨🌞🤒READ MORE
109,Battery is low. Or 7 hours only single use battery in lowREAD MORE
110,READ MORE
111,Battery issueREAD MORE
112,Good cameraREAD MORE
113,Good quality and (extra Apps can be disabled) (but camer don't have wide angle option) battery is good (mobile looks are osm)READ MORE
114,Nice pic video call cemeraREAD MORE
115,"Mobile is good, camera quality is also good, this is the cheapest price that you have got an edge mobile.READ MORE"
116,READ MORE
117,Mobile has heating problem 😰😨🌞🤒READ MORE
118,Battery is low. Or 7 hours only single use battery in lowREAD MORE
119,Got what I was expecting 🧡READ MORE
120,READ MORE
121,Awesome phone  feel in hand like expensive phone..READ MORE
122,Looks wise and performance it's fine but camera quality is worst would prefer not to buy this product if you're going to purchase this for camera.Realme XT camera was better than this.READ MORE
123,At this Price point this phone is totally very good 👍👍 👍READ MORE
124,One of the best DeviceREAD MORE
125,One of the worst camera I have ever seen. Giving 100 mp but it's not even 50Mp . Avoid this model. You will regret if you buy. There will be no detailing in pics. Worst photo everREAD MORE
126,Superb product.READ MORE
127,Worst cameraREAD MORE
128,Good phoneREAD MORE
129,Heating issue lag issue don't buyREAD MORE
130,Good phonREAD MORE
131,Phone is much heating than expected I usually using it in my room but in normal temperature it heats very muchIn this range you can select another deviceOn charger written 80w but in charging it shows 67w and 67w charges as like my 33w chargerVery bad phone it is hanging in just a weekREAD MORE
132,"The best phone in this category. Fabulous design, fantastic performance, wonderful display, and looks premium. The one and only issue with this mobile is the battery, which is draining fast. But the ultra fast charging is at its best. They could have optimised it better. I hope they optimise this issue in the upcoming updates.Getting heated...!!READ MORE"
133,Nice looking phoneREAD MORE
134,It is not of that level as it is being boast of. Not bad not so good.READ MORE
135,Good productREAD MORE
136,Good..READ MORE
137,Too much add in this mobileREAD MORE
138,Awesome 😎READ MORE
139,Good phonREAD MORE
140,READ MORE
141,Phone is much heating than expected I usually using it in my room but in normal temperature it heats very muchIn this range you can select another deviceOn charger written 80w but in charging it shows 67w and 67w charges as like my 33w chargerVery bad phone it is hanging in just a weekREAD MORE
142,"The best phone in this category. Fabulous design, fantastic performance, wonderful display, and looks premium. The one and only issue with this mobile is the battery, which is draining fast. But the ultra fast charging is at its best. They could have optimised it better. I hope they optimise this issue in the upcoming updates.Getting heated...!!READ MORE"
143,Nice looking phoneREAD MORE
144,Very bad camara plz don't take 😔 anyoneREAD MORE
145,"This is my review after 10 days.After days of searching for a new phone atlast i found a phone that is capable of my expectation.pros * looks great* mind-blowing display quality* curved display at this rate (even though there are other phones with curved display but it is the latest in market so) * fast charging* Good processor(if you had watched the review of youtubers about this phone,you will understand for what users it is apt for) cons* camera is not up to the level.(At this ...READ MORE"
146,Good productREAD MORE
147,Value of money 💰Display is very good 😊READ MORE
148,Good..READ MORE
149,Too much add in this mobileREAD MORE
150,"Front camera is totally waste. Horrible selfies, white fade coming on photos.. wasteREAD MORE"
151,GoodREAD MORE
152,Amazing camera quality with dashing design I thanks to Realme for Value for MoneyREAD MORE
153,Under 25k all the specifications are justified.Best in this phone I like most is display.READ MORE
154,1) this mobile is not suitable for 5g .. very slow2) Camera also not good ....READ MORE
155,I posted this review after using 1 week of this mobile...when I compare to redmi note 7 pro (my old mobile )  ..not upto that level ...I facing bad experience in performace level ...it's very slow and battery is drying fast....8 GB Ram is just a number it's performed like 4gb Ram ....I attract only on mobile design and it's curved display...there is nothing special in this mobile exept display and design..not worth for the money😢😢READ MORE
156,Camera quality is not good trust me!!READ MORE
157,Heat issueREAD MORE
158,Very niceREAD MORE
159,"Camera quality is awesome, battery life is also good.. overall 9/10READ MORE"
160,Amazing camera quality with dashing design I thanks to Realme for Value for MoneyREAD MORE
161,Product is good 👍READ MORE
162,Super niceREAD MORE
163,This price not buying this phone hanging and eating issueREAD MORE
164,Camera quality poor it's 100 megapixel but when u take photo full zoom 10 x photo is breakbleREAD MORE
165,Good camera 📷 quality 😉 Check others Pics..... ig...@atulyt_08READ MORE
166,"i buy from india and i brought to qatar, here not working network lockedREAD MORE"
167,Best phone in this segment at present.READ MORE
168,Perfect machineREAD MORE
169,The product is no doubt excellent in the camera and the display... The performance is too good according to the price... Thanks Flipkart for suggesting this in my feed 🍂🙇READ MORE
170,Very nice 💯🙂READ MORE
171,Very good 👍😊READ MORE
172,It have software issue. It automatically reboot itself 4 time in 6-7 hrs.Worst mobile in performance.READ MORE
173,"Good camera quality, great future 👍🏿READ MORE"
174,NiceREAD MORE
175,"Good phone all round phone best phone in this price belive to by.only problams in blotwares ,hot app and hot games .you set those problems in switch on timeREAD MORE"
176,Curve display simply osmREAD MORE
177,Very nice👍READ MORE
178,"Mobile camera quality is 3rd class, don't buy process was also poor performance. 3rd 3rd 3rd class mobile and camera quality very very poorREAD MORE"
179,Best mobile excellant camera superREAD MORE
180,Good camra and good performanceREAD MORE
181,I will share genuine review about the device. The device design is awesome and the performance of the device is good for personal use. The battery backup is also good and the charging speed of the device is fast. And the camera quality is average. Iam using this product as my permanent device because I like this product so much. The display was the device is very awesome. So iam recommend this device to everyone.READ MORE
182,"Camera is not as good ,100 MP is for show off only Battery drains quickREAD MORE"
183,camera result...... average...READ MORE
184,Amazing mobile thank you realme. 🙏✨READ MORE
185,Display blink sometimesREAD MORE
186,Product is nice but I am facing trouble in face unlock it is working rarely and showing too much adsREAD MORE
187,Best phone in this rangeREAD MORE
188,"Design:- AwesomePerformance:- At this price range it's Ok typeSpeaker:- It's quite loud 📢Mic 🎙️:- No problemSoftware experience:- If you uninstall unnecessary pre installed apps than it is better  than other brand's UICharging speed:- ExcellentBattery:- AwasomeCamera:- Rear is Good but at this price range you will definitely get other options, but front camera is Better than rear .READ MORE"
189,Just don't buyREAD MORE
190,Pros:DisplayBatteryDesignCameraPerformanceConsCamera lighting focusREAD MORE
191,Proximity Sensor while calling is not responding properly and also the display is not shows the finger print option until we press the power buttonREAD MORE
192,NiceREAD MORE
193,Mobile hang on first day.Display in excellent 👍.Many unnecessary apps are pre installed.I don't like app recommendations.. overall this phone is nice for normal use.READ MORE
194,phone camera quality and performance is not good.READ MORE
195,Camara quality is not good and battery is draining very fastly.Too much heating while gamingREAD MORE
196,Camera is avg and rest is goodREAD MORE
197,battery draining fast without any use.READ MORE
198,"handset is quite good .by holding it you get premium phone feel ,only drawback is many bloatwares and ad recommendation in this phone ,otherwise value for moneyREAD MORE"
199,Product is good and price is well because all is wellREAD MORE
200,Like itREAD MORE
201,This phone design and display is great and battery is also good but in my phone fast charging issue 0% to 100% more than 1 hour time take.. other wise no issue in this phone ..READ MORE
202,GoodREAD MORE
203,"Awesome camera 📷Best Street Photograph,Portrait Mode is Super  coolREAD MORE"
204,Camera quality average haiREAD MORE
205,Superb mobile good performance overall display is superREAD MORE
206,Better but camera is not badREAD MORE
207,Nice product mobile performance is superREAD MORE
208,Mobile hang on first day.Display in excellent 👍.Many unnecessary apps are pre installed.I don't like app recommendations.. overall this phone is nice for normal use.READ MORE
209,phone camera quality and performance is not good.READ MORE
210,Camara quality is not good and battery is draining very fastly.Too much heating while gamingREAD MORE
211,Camera is avg and rest is goodREAD MORE
212,battery draining fast without any use.READ MORE
213,Nic mobile but battery issueREAD MORE
214,Phone is very much nice and performance is goodREAD MORE
215,"other than extra apps and ads , everything is fine , just buy it and you can remove the unnecessary ads and apps.. But if you want the gaming phone , I prefer iIqoo neo 6 which is best under 35kREAD MORE"
216,Except camera ....all good ....READ MORE
217,This phone design and display is great and battery is also good but in my phone fast charging issue 0% to 100% more than 1 hour time take.. other wise no issue in this phone ..READ MORE
218,Mobile heetREAD MORE
219,This phone heated more than 1hr usesREAD MORE
220,Veri niceREAD MORE
221,GoodREAD MORE
222,Very slow charging80w charger my a$$😡READ MORE
223,Phone is display is  very good 5/5Battery capacity power is good 5/5Phone performance is also good games play is also good Phone camera is normal user is goodREAD MORE
224,Good n premium designREAD MORE
225,"Good phone in mid range, luxury designREAD MORE"
226,GoodREAD MORE
227,Design is out of the world and performance is very goodREAD MORE
228,"Best design and kooks performance is very good, need to improve realme UI lots of bloatware and pre installed apps. Little bit issue with battery backupREAD MORE"
229,Amazing product by Realme. Awesome Camera and super fast battery charging. It takes approx 55 min to full charge from 18%. Flipkart delivered the product on time. Thanks.READ MORE
230,Nice Camera 🥰Batter Good 👍READ MORE
231,Looking is very goodBut camra worstCharger worst Because very slowly chargingAverage ratingREAD MORE
232,"Display is awesomePhone looks premiumGood to hold in handBattery life is average,Fast chargingReal me UI is great, provides all optionsCons:No wide angle camera in this high priceBattery drains quickly even with normal usageREAD MORE"
233,This product not connected 5g . Performance is very below average.also mobile overheating issue and charging filling take time more than 1 hr .this product was not good..READ MORE
234,This mobile camera quality is very bad..Please u can upgrade the camera quality...READ MORE
235,Very very nice mobile 📲📱 cemra to beautiful and curve display is very nice go for itREAD MORE
236,This phone okay but we have problem with battery....READ MORE
237,"Mobile processors is very slow,Something mobile will be hangREAD MORE"
238,Camera so disappointed only display design phone performance decent note properly gaming☺️ better option iq neo 6 and moto edge 40READ MORE
239,Battery heating problemREAD MORE
240,It's very good productREAD MORE
241,Nice display 🤩Battery pickup is very goodSound quality excellent 👍Camera quality is amazing 🤩READ MORE
242,Nice productREAD MORE
243,"As per looks it is a very good looking phone at this price range ,in hand feel is also very good, leather back finish gives the phone a premium touch too.In terms of performance I would say satisfactory not the best which is other brands are offering even at the same price or little bit higher but if you are not a performance enthusiast and doesn't do heavy gaming or any other task then definitely you should go with this phone . Next thing the battery of the phone is really commendable it do...READ MORE"
244,Battery backup not upto mark and draining like it is 4000 mAH. Other wise it is ok.READ MORE
245,Superb phoneREAD MORE
246,The internet speed is not good. When I insert the same sim in other phone the signal is goodREAD MORE
247,The Android system is not working properly and the mobile is being hanged regularlyREAD MORE
248,Over heating mobile yarum vanga VendamREAD MORE
249,very nice phone i am using it since 1 month camera is fine battery is very goodREAD MORE
250,Dont buy this phone due to heating issueREAD MORE
251,Decent camera qualityBattery is also good for normal users Performance is good Display is amazing with the Dolby AtmosI really recommend for the of 25k Go for it without any hesitation you will not Disappoint after buying Great Superfast Delivery!READ MORE
252,Worst camera there is no optimization of pics and very disappointed with this cameraREAD MORE
253,So goodREAD MORE
254,Camera quality is not goodREAD MORE
255,Camera badREAD MORE
256,Camera is not as expected...the quality of photos are  poor .and rest everything goodREAD MORE
257,Nice productREAD MORE
258,Pros.. Superb device at this price point❤Smooth experience while gaming browsing surfing internetAnd the display is really ❤.. Camera is also best in segment.. Cons Battery drains bit faster because of 5GNeed bit optimization on UIALTHOUGH they removed many Bloatwares . You just need to update this device ads will be automatically stoped .. Sharing this experience after 20 daysREAD MORE
259,Battery draining fast...READ MORE
260,"As per looks it is a very good looking phone at this price range ,in hand feel is also very good, leather back finish gives the phone a premium touch too.In terms of performance I would say satisfactory not the best which is other brands are offering even at the same price or little bit higher but if you are not a performance enthusiast and doesn't do heavy gaming or any other task then definitely you should go with this phone . Next thing the battery of the phone is really commendable it do...READ MORE"
261,"Best phone at this price, camera is just wow display is super cool 😎 😍 night clicks are just super wow😍🔥🔥READ MORE"
262,Nice camera better than this price and nice to battery performanceREAD MORE
263,Looking goodREAD MORE
264,Nice phone at this price because of no one can give camera and processor both strongREAD MORE
265,Good and beautiful mobileREAD MORE
266,So match heating problems also battry discharge going fast I suggest never by this product.READ MORE
267,Neither good nor bad ... Valuable for just rs. 24k .. but camera and battery is not that much satisfying..READ MORE
268,"Good one.. At start i felt heating issue.... Day by day, mobile getting better.. Love this feeling touch of mobile..... Premium curved display 🔥🔥...... Best for regular user.... Not for all time gamers..... Battery decent one.. Worth after 3 weeks use... Let's c in upcoming daysREAD MORE"
