,reviews
269,One week used after  Honest Review* Camera not worth for 100mb but decent camera Quality* Battery very well Super fast Charging* Design next level Premium Look* Over-all Performance Good 💯* Under 25k it's 90% Worthy- Only 2 nagative thinks we found use one or two hours continuously feel little Heating issue - chargeing back-up not wellREAD MORE
270,"Very good, worth itREAD MORE"
271,Over heating issue this mobile is so heating 😡😡😡😡😡🤬READ MORE
272,Great camaraREAD MORE
273,"Cemara quality is very bad, doesn't look 20k+ phone where camera come out very well. UI is very dull. Extra loook nothing good in phone.READ MORE"
274,Very good phone for who want a phone for design and displayThis phone not for who are gaming lover and need a performanceREAD MORE
275,Best qualityREAD MORE
276,"Don't buy ,this isn't worth your 24k ,Buy it if you are getting it under 18k.Heating starts after 1.5hr of usage Camera is nothing just for show . Even my 4 year old Realme 5pro takes much better photos then this one ,it gives pixelated and bright photo even quality wise it gives nothing.Charging is same as vooc no difference between vooc and super vooc.Don't buy ,waste of money .No return policies are there on realme's product.READ MORE"
277,not badREAD MORE
278,The camera is very bad. Totally not worth the price. Very disappointedREAD MORE
279,GoodREAD MORE
280,Happy with the product deliveredREAD MORE
281,Value moneyREAD MORE
282,Superb phone by Realme 🥰READ MORE
283,GoodREAD MORE
284,Writing this review after 10 days of using the phone.I Loved it especially the design.I has a  Great Display. Performance is also good considering the price. With the big display and 120 Hz Refresh rate battery backup is awesome.  In average usage I get nearly 7 to 8 hours of screen on time  And if play games it is 5 hours.Camera needs improvements. It can be done through a software update.Overall my experience with this phone is great....READ MORE
285,Very good performance camera look sab best hai I am very happy for thisREAD MORE
286,Nice oneREAD MORE
287,Nice productREAD MORE
288,Veri nice product thanx for filpkartREAD MORE
289,"If it is 6000 mah battery , then it is perfect worthy for price .....READ MORE"
290,Product is better and battery backup is so goodI like itREAD MORE
291,GoodREAD MORE
292,Phone looking and camera 📸 ok very nice phoneREAD MORE
293,BAD AND IRRATATINGREAD MORE
294,Worst product not worth valueREAD MORE
295,Supar product in this rangeREAD MORE
296,"Best in the segment . Overall performance is good except the camera ,at this price range this type of camera is not expected.READ MORE"
297,waste of money camera quality is too cheapREAD MORE
298,battery issueREAD MORE
299,Nise phone ..... super 👌READ MORE
300,Weast mobile in FlipkartNo1 weast mobileREAD MORE
301,"Very good looking , attractive device performance is also very good , 60 fps bgmi smoothREAD MORE"
302,"I like its curved display, battery life and camera too.Battery will end in 1.5 day.Camera is too good.READ MORE"
303,I like the product so much... I like the deisign..i dont like its heating when we use hardly it may cause to warm the warm the phone... Dont heat its small warm it is the smallest problem i fase.. Another side it is perfect for allREAD MORE
304,READ MORE
305,Lovely phoneREAD MORE
306,Camera worstREAD MORE
307,GoodREAD MORE
308,It's feeling like TrafficREAD MORE
309,It's good to use but curve display can break anytime.READ MORE
310,Nice MobileREAD MORE
311,Simply awesome by look wise .... Display superbOverall 4.75\5READ MORE
312,Good cameraREAD MORE
313,GoodREAD MORE
314,Amazing camera nd display..but battery back up horrible..READ MORE
315,In this price this mobile is very good bt the battery life is not as per standard.READ MORE
316,Phone is so cool and performance good 👍 but back camera not good 😔READ MORE
317,"Awesome product, Thank you FlipkartREAD MORE"
318,Phone looking and camera 📸 ok very nice phoneREAD MORE
319,BAD AND IRRATATINGREAD MORE
320,Worst product not worth valueREAD MORE
321,Battery performance not good. Drain it fast.READ MORE
322,"Best in the segment . Overall performance is good except the camera ,at this price range this type of camera is not expected.READ MORE"
323,waste of money camera quality is too cheapREAD MORE
324,Good productREAD MORE
325,battery issueREAD MORE
326,GoodREAD MORE
327,performance very good camera don't buy this phone Very amazing phone mobile is a very badREAD MORE
328,"The camera is really great, and the photos taken are very beautiful. I have shown off my photos with my friends and shared them on social networking sites.READ MORE"
329,Awesome 😎READ MORE
330,"Superb quality smooth running,✌️✌️✌️READ MORE"
331,GoodREAD MORE
332,SuperREAD MORE
333,The display is very poor and not worth it for the price tagREAD MORE
334,waste of money.1. Motion sensor is not working all the time.2. finger lock not working properly.3. And many other problems like when you push power button google assistant open all the time.Its batter to purchase Oppo Reno 8T 5G.READ MORE
335,Phone gets slow down in a month very slow phone dont like it .only display is good in phoneworst realme 🤢🤮🤮READ MORE
336,this phone has good camera and display is soo good i love the display of this phoneREAD MORE
337,"This phone has next level craze in my area, every one getting happy or Shocked after seeing my phone because of it's awesome design, and the camera part of this phone is excellent ( thanks to OIS ), Aslo display of the phone is top notch.READ MORE"
338,Great phone👌READ MORE
339,Best performance best design and good battery backup with 80 v chargerREAD MORE
340,Very good mobileREAD MORE
341,😎 awesome..READ MORE
342,Over-all phone is good but realme should have to provide sanpdragon prosessor form this segment of price range .. wonderful experience after 10 daysREAD MORE
343,Amazing camera nd display..but battery back up horrible..READ MORE
344,Best mobile phone 📱READ MORE
345,If you touch and feel mobile you won't go for other phoneREAD MORE
346,Camera and battery should developREAD MORE
347,READ MORE
348,READ MORE
349,Phone Is Just Awesome And Very Premium.READ MORE
350,Good productREAD MORE
351,Cemera not goodREAD MORE
352,Design very nice.READ MORE
353,READ MORE
354,Overall Good PerfomanceREAD MORE
355,READ MORE
356,Looking great. No issues observed wrt battery or performance. Great purchase indeedREAD MORE
357,Sera phone vaiiREAD MORE
358,"Loved it every bit, should have included a wide angle camera in this model other then that no complaints.READ MORE"
359,Best Product 1St ReviewREAD MORE
360,GoodREAD MORE
361,READ MORE
362,This phone is not a 100MP camera qualityREAD MORE
363,Not goodREAD MORE
364,Bought friendly mobileREAD MORE
365,"Design is awesome 👌 and curved oled display is brilliant at the price and performance is decent, battery is also OKREAD MORE"
366,Phone performance decent with this price point but actually having problem with the battery maybe its because of 5g network and the camera quality my gosh the bad and the worst camera quality ever the night pictures are so bad that I would never opened camera in night again otherwise the display caught all the attention it's fabulous and the major advantage of phone.READ MORE
367,Display and design .. 🔥READ MORE
368,Good one buy it... don't think too muchREAD MORE
369,Super pic and best productREAD MORE
370,Over all perform wellREAD MORE
371,phone good but battery drain automaticREAD MORE
372,Really too goodREAD MORE
373,Dont buy this phone screen refresh rate is not good touch responce is sow only camer was good RENO 8T is better than all segments.....READ MORE
374,Super 📸READ MORE
375,Very good productREAD MORE
376,Nice mobile iam very happyREAD MORE
377,GoodREAD MORE
378,Good productREAD MORE
379,Good 💯👍READ MORE
380,Very good ProductREAD MORE
381,NiceREAD MORE
382,The product is very nice according to the price point. You can go for it.READ MORE
383,Product is good. I like design. IREAD MORE
384,Very nice phone this segment and camra is very super and display is awesome and battery is good performance.READ MORE
385,Price value best phoneREAD MORE
386,Overall a good phoneREAD MORE
387,Please don't buy this type of product and don't encourage this type of company.worst mobile I have seen for everREAD MORE
388,As per look realme 11 pro is killer overall mobile performance and all is ok ok....something is mising hope you guy's understood....READ MORE
389,"Fantastic phone at this price range .battery back up is good ,better than average phones of this segment.camera however is a big disappointing .doesn't come upto mark of 100 mp .may be with updates it improves.display is top notchREAD MORE"
390,Amazing camera with touch phoneREAD MORE
391,Nice productREAD MORE
392,This phone super camera and display qualityREAD MORE
393,"Phone perfomence , speed super good 👍READ MORE"
394,Good PhoneREAD MORE
395,NiceREAD MORE
396,"It's a mind blowing camera, display, battery backup everything is good.READ MORE"
397,Performance us too goodREAD MORE
398,ExcellentREAD MORE
399,Butiful setREAD MORE
400,Nice RealmeREAD MORE
401,Good productREAD MORE
402,Camera quality not goodREAD MORE
403,"Avarage, decent cameraREAD MORE"
404,AwesomeREAD MORE
405,Very goodREAD MORE
406,Good loock and very fast good cameraREAD MORE
407,Good oneREAD MORE
408,Display and design are super.READ MORE
409,Display and design are super.READ MORE
410,Nice to see thisREAD MORE
411,Too worst some times hang the phone please don't buyREAD MORE
412,Avg phone not much 100 mega pixel is zest no no useREAD MORE
413,GoodREAD MORE
414,Nice smartphone 👍❤️READ MORE
415,Osm mobileREAD MORE
416,AwesomeREAD MORE
417,"I like the design and the overall look, Phone is awesome, value for money. Go for it without second thought 👍READ MORE"
418,Nice mobile and niceREAD MORE
419,Design n colour was gud like this very muchREAD MORE
420,Nice designed mobile With wonderful display 🙂READ MORE
421,Average mobile.Nothing special features to use. There is no wide angle.READ MORE
422,GoodREAD MORE
423,NiceREAD MORE
424,READ MORE
425,Product is good but delivery boy is awsomeREAD MORE
426,It's a all rounder phone but it have some heating issuesREAD MORE
427,READ MORE
428,Not goodREAD MORE
429,This phone very slimREAD MORE
430,Very very nice product 🥰READ MORE
431,Nice mobileREAD MORE
432,"Very nice mobile, just back cam little bit heavy, remaining all simply superb in this price.READ MORE"
433,All ok but camera disappointed 😔 night mode camera not working properly and normal photos coming softy pictures iam not satisfied in this budget😔😔READ MORE
434,Heating problem like pubgCamera ok okBtry ok okCharging speed very goodDisplay awesomeDesign again awesomeREAD MORE
435,This is my third Realme phone after Realme 6 Pro and Realme X3 Superzoom. IT IS A COMPLETE HEAD TURNER. 💯💥My one day use review:Camera: 8/10Design: 10/10Battery: 9/10Charging: 10/10Gaming: 10/10UI:10/10Display: 10/10Head Turner: 10/10Fingerprint: 9/10Face ID: 10/10Price: 9/10Value for Money: 10/10Conclusion: at 24000 this is a steal deal. Just go for it. Ankh band karke🙈....❤️READ MORE
436,"Decent camera, premium look and design and good for gaming .READ MORE"
437,"Cemara just okay, I am not good on productREAD MORE"
438,camera quality was not too good.READ MORE
439,"As i expect it is not like that.Screen on and off sensor is not working proper, even after two update.Camera is like ok ok.It's charge quality. Processor is not justify the price.My previous phone poco x 2 much better from realme 11 proREAD MORE"
440,Good productREAD MORE
441,This phone is really premium in handfeel and performance is superbREAD MORE
442,Just an average phone with too much hype. It's worth Rs.15k and surely it will touch this price very soon for its poor performance. Camera is quite badREAD MORE
443,Good I like thisREAD MORE
444,Value for money.READ MORE
445,1 curved display best for watching videos photos Social media apps and youtube2 good design 3 performance is average not good for gaming specially high end games. You can play medium level games4 camera is below average do not buy this phone for camera no 4k 60 fps selfie camera also not good 5 battery Is good I got 6 to 7 hour screen on timeREAD MORE
446,Thank realme.. 11 pro nice phone . beautiful disine and nice photo camera best parformance.  good  Dolby sond . beautiful display.. good very good . superb excellent nice. ...READ MORE
447,Nice camera and premium qualityREAD MORE
448,Charged heating customer car below 7 days not responding poor productREAD MORE
449,Excellent ProductExcellent DeliveryREAD MORE
450,Front Camera is not upto markBack Camera is average Battery Backup is GoodDisplay is awesome Fingerprint Sensor works fastREAD MORE
451,Product is really good and very user friendly to handleREAD MORE
452,Overall phone is value for money but software experience may hit you hard.READ MORE
453,Best phoneREAD MORE
454,"Phone is to Good , camera performance 10/10, Display like a Diamond.READ MORE"
455,Very nice😊READ MORE
456,Without any hesitation just buy this product .READ MORE
457,"Only highlights is curve display and design....Camera, performance,haptic and battery backup is average.Please don't buy this phone .go for OnePlus Nord ce3.READ MORE"
458,Overall okREAD MORE
459,This phone amazingREAD MORE
460,The realme 11pro 5G device is very impressive with its outstanding performance with the integrated media tek chipset.A camera is a big thing the primary sensor is a 100MP sensor in the 11pro. The photos come out with quite good dynamic range and sharp photos.READ MORE
461,After using it for 1 week this is the best smartphone Realme has launched. It supports 5G so well but camera is not up to mark.READ MORE
462,GodREAD MORE
463,NiceREAD MORE
464,Best camera phone for 200 mpREAD MORE
465,Nice productREAD MORE
466,This phone super camera and display qualityREAD MORE
467,Battery capacity no 4000mh battery capacity battery 50008mh no 4000mhREAD MORE
468,Good PhoneREAD MORE
469,NiceREAD MORE
470,"It's a mind blowing camera, display, battery backup everything is good.READ MORE"
471,Very bad product.battry drean very fastREAD MORE
472,Performance us too goodREAD MORE
473,ExcellentREAD MORE
474,Good phone in that priceREAD MORE
475,Like goodREAD MORE
476,If you want decent performance with awesome display and designThen no doubt it's the best phone in this price segmentREAD MORE
477,"Being a Realme fan, awesome Phone, design is very catchy. The camera and battery backup is best. Must go for it 😉READ MORE"
478,Very goodREAD MORE
479,All features are good in this price range but some camera issue and battery drain so fast👍 just go for itREAD MORE
480,At one word we can say it as all rounder.READ MORE
481,Extremely good productREAD MORE
482,Nice mobile with good looking1) fast charging 25 minutes full charge from 2%    to 100%2) Best in level of camera 200 MP3) battery back up also very good.READ MORE
483,Don't Like This Camera . Display And Sound Quality Not Below fro MoneyREAD MORE
484,Battery chargingREAD MORE
485,"Mobile phone is awesome design , performance,battery and etc all good but front camera missing details in low light and a slight   difference in some apps performence like its takes very long time to processes.READ MORE"
486,Ordered 2 same mobile at the same time.The mobile build in quality is awesome.look is great and operation is quite smooth.But my delivery experience for one mobile was horribleREAD MORE
487,READ MORE
488,Lovely productREAD MORE
489,"Osm camera phone ,,, I will recommend for this phone under this price . Go for it .READ MORE"
490,NiveREAD MORE
491,Good but price is little bit highREAD MORE
492,Awesome go for itREAD MORE
493,"Wonderful Phone and i strongly recommend purchase with Seller Grahgoods retail, because seller is goodREAD MORE"
494,So much for 100 mp My samsungs 32 was better in qualityREAD MORE
495,I like this phoneREAD MORE
496,GoodREAD MORE
497,Not bad in this price range Go for itREAD MORE
498,Super nice...Worth it...! Love this product..❤️❤️READ MORE
499,Best mobile under 25 kBest design and performanceREAD MORE
500,Product is very goodREAD MORE
501,"It's awsmm phone, very good camera and all other features ,I loved it.READ MORE"
502,Battery backup is not good twice a day I have to charge my phoneREAD MORE
503,"Display is awesomePhone looks premiumGood to hold in handBattery life is average,Fast chargingReal me UI is great, provides all optionsCons:No wide angle camera in this high priceBattery drains quickly even with normal usageREAD MORE"
504,Heating problem like pubgCamera ok okBtry ok okCharging speed very goodDisplay awesomeDesign again awesomeREAD MORE
505,This is my third Realme phone after Realme 6 Pro and Realme X3 Superzoom. IT IS A COMPLETE HEAD TURNER. 💯💥My one day use review:Camera: 8/10Design: 10/10Battery: 9/10Charging: 10/10Gaming: 10/10UI:10/10Display: 10/10Head Turner: 10/10Fingerprint: 9/10Face ID: 10/10Price: 9/10Value for Money: 10/10Conclusion: at 24000 this is a steal deal. Just go for it. Ankh band karke🙈....❤️READ MORE
506,"Decent camera, premium look and design and good for gaming .READ MORE"
507,"Cemara just okay, I am not good on productREAD MORE"
508,camera quality was not too good.READ MORE
509,Nice mobileREAD MORE
510,Good productREAD MORE
511,This phone is really premium in handfeel and performance is superbREAD MORE
512,Just an average phone with too much hype. It's worth Rs.15k and surely it will touch this price very soon for its poor performance. Camera is quite badREAD MORE
513,Good I like thisREAD MORE
514,Value for money.READ MORE
515,1 curved display best for watching videos photos Social media apps and youtube2 good design 3 performance is average not good for gaming specially high end games. You can play medium level games4 camera is below average do not buy this phone for camera no 4k 60 fps selfie camera also not good 5 battery Is good I got 6 to 7 hour screen on timeREAD MORE
516,Thank realme.. 11 pro nice phone . beautiful disine and nice photo camera best parformance.  good  Dolby sond . beautiful display.. good very good . superb excellent nice. ...READ MORE
517,Nice camera and premium qualityREAD MORE
518,Charged heating customer car below 7 days not responding poor productREAD MORE
519,Excellent ProductExcellent DeliveryREAD MORE
520,Super price value for moneyREAD MORE
521,Good money worthy phoneREAD MORE
522,Super phone but back came not clarity other wise phone goodREAD MORE
523,Value for moneyREAD MORE
524,This phone performs better than I expectedREAD MORE
525,Just okREAD MORE
526,Good mobileREAD MORE
527,Mobile very nice but lower lower add add add hot game hot appsREAD MORE
528,"I am writing my review after one week of usage, and found my phone behaves on its own. Like display flickering and icons got selected automatically. I couldn't able to do anything unless I rebooted the device to bring it to normal mode. I never faced this type of situation with my previous phones.READ MORE"
529,Very good phoneREAD MORE
530,Very nice phone in this price range. This is the best one compare to realme 10 pro. Battery is some what disappointed. All other features are goodREAD MORE
531,Camera is awosemREAD MORE
532,AffordableREAD MORE
533,GoodREAD MORE
534,Good 👍READ MORE
535,"It's been more than 10 days I am using this phone 1.Design -  awesome 2.build - good 3. Battery backup - can be better but good for average user phone call , video , photo click not  for gamer 4.UI curve display looks elegant colors are good 5.performance 120  refresh rate from company   but support mostly 60 to 90 fps very rare it is 1206.Comes with 80w vooc charger but phone support only 67 W it is weird 7.charging time is very less about 23 to 25 minute for 100 percent charging 8.n...READ MORE"
536,Amazing 😍 go for itREAD MORE
537,Nice productREAD MORE
538,Very nice 👍READ MORE
539,SuperbREAD MORE
540,StylishREAD MORE
541,"Absolutely amazing mobile, very handy nice camera and excellent performance.I am loving it !!READ MORE"
542,Very beautiful realme 11 pro and very smoothly running Thanks realme and camera quality is very wonderful 😊👍READ MORE
543,Product is awesomeREAD MORE
544,Not bad but camera not clarity and battery not stable for one dayREAD MORE
545,SuperREAD MORE
546,NiceREAD MORE
547,Very nice phone... looking superbREAD MORE
548,Under 30k like good mobileREAD MORE
549,Worth cameraREAD MORE
550,Automatic screen off and camera also pls don't buy this phoneREAD MORE
551,GoodREAD MORE
552,READ MORE
553,GoodREAD MORE
554,Value for moneyREAD MORE
555,Nice but battery 🔋 back-up not long time usedREAD MORE
556,Good productREAD MORE
557,Not bad in this price range Go for itREAD MORE
558,"It is a ok ok phone set but , it started to have hanging problem just after 1 month .READ MORE"
559,Good productREAD MORE
560,NycREAD MORE
561,Very good this price sigmentREAD MORE
562,This is the best mobile in my life ..If u search the best phone then u definitely go for itREAD MORE
563,Nice mobileREAD MORE
564,"Very amazing looking phone.You are never gonna regret this buy.Amazing camera, Amazing design.Sometimes app crashes but that is okay at this price point.Smooth gaming experience.READ MORE"
565,GoodREAD MORE
566,All are good but tempered glass problem.READ MORE
567,"This is my review after 10 days.After days of searching for a new phone atlast i found a phone that is capable of my expectation.pros * looks great* mind-blowing display quality* curved display at this rate (even though there are other phones with curved display but it is the latest in market so) * fast charging* Good processor(if you had watched the review of youtubers about this phone,you will understand for what users it is apt for) cons* camera is not up to the level.(At this ...READ MORE"
568,Very badREAD MORE
569,NiceREAD MORE
570,Super super good 👍👍👌👌👌READ MORE
571,Awesome phoneREAD MORE
572,TqREAD MORE
573,NiceREAD MORE
574,GoodREAD MORE
575,The mobile is osm👌 camera performance is so goodREAD MORE
576,Good performance with this price range.READ MORE
577,"Processor is just ok, Cameras are not very good and useful. Other aspects is good.READ MORE"
578,Nice phoneREAD MORE
579,Mind blowing phone...but I am not exchanging my old phone to FK. Offer Price is too low.READ MORE
580,Good 😊 one worth for moneyREAD MORE
581,Osm cameraREAD MORE
582,ExlentREAD MORE
583,Value for moneyREAD MORE
584,This phone performs better than I expectedREAD MORE
585,Just okREAD MORE
586,Good mobileREAD MORE
587,Very Good Phone For normal users I'm recommended itREAD MORE
588,Mobile very nice but lower lower add add add hot game hot appsREAD MORE
589,Proximity Sensor while calling is not responding properly and also the display is not shows the finger print option until we press the power buttonREAD MORE
590,"Light weight ,Thickness is high while compared to Vivo mobile, Battery charge is good Take 45 mins to charge the mobile.Over all wroth for money..READ MORE"
591,Fantastic back side and also mobile design niceREAD MORE
592,Love this mobile the design of vegon leather is so cool the display of this mobile so superb love thi mobile Cemra quality is superb sound is also goodREAD MORE
593,I love this phone super experience the Flipkart I love the Flipkart any new product I will seeREAD MORE
594,Good mobile. But camera very poor qualityREAD MORE
595,Nice phoneREAD MORE
596,The good oneREAD MORE
597,Too good picture qualityREAD MORE
598,Wast productREAD MORE
599,Camera quality is very poor. Batter backup is very bad.READ MORE
600,Good quality camera and best mobile phoneREAD MORE
601,This phone is amazingREAD MORE
602,ExllentREAD MORE
603,GoodREAD MORE
604,It is really worth it to buy this products for everyone thanks FLIPKARTREAD MORE
605,Camara not as per standardBattery drain fast Touch n performance is good.But seems costly in this rangeREAD MORE
606,SuperREAD MORE
607,"Good design , battery backup, flawless experience,Display and sound are also good.Not felt great with camera though it is 100mp within the price range and color options hence given 4*READ MORE"
608,Nice phoneREAD MORE
609,GoodREAD MORE
610,"It's  perimum range for mobile,camera is very nice,gaming is normal play.READ MORE"
611,Best camera quiltyREAD MORE
612,Very nice phone... looking superbREAD MORE
613,Under 30k like good mobileREAD MORE
614,HappyREAD MORE
615,Automatic screen off and camera also pls don't buy this phoneREAD MORE
616,Good that's itREAD MORE
617,GoodREAD MORE
618,Gud phoneREAD MORE
619,Design good but battery backup is very poor and camera performance is okREAD MORE
620,Great mobile with avg camera and suprrb leather designREAD MORE
621,👍 goodREAD MORE
622,Nice productREAD MORE
623,Not so good cameraREAD MORE
624,I'm happy with product 😊READ MORE
625,OkREAD MORE
626,Value for money 💰READ MORE
627,Very good phone so I am very happyREAD MORE
628,After using 1 month front camera blue.grainy picture captureREAD MORE
629,GreatREAD MORE
630,Good but back side painting not permanentREAD MORE
631,"New phone heating problem, camera pic after zooming blurred.READ MORE"
632,Best phone in this segment at present.READ MORE
633,Very badREAD MORE
634,READ MORE
635,Verry good mobile and all good product go for it no 1 realmeREAD MORE
636,NiceREAD MORE
637,Super super good 👍👍👌👌👌READ MORE
638,Value for money....READ MORE
639,Cheating in the name of exchange of old mobile.READ MORE
640,Awesome phoneREAD MORE
641,NiceREAD MORE
642,Nice phone camera is GoodREAD MORE
643,"Good, need to work on camera and battery life, apart from these 2, perfect budget phone.READ MORE"
644,Nice productREAD MORE
645,Great design and lovely touch quality value for money thank youPlz improve camera quality in this price plz🙂READ MORE
